{"$id":"https://github.com/andrewdhorowitz/fleet-kit/publish-registry/publish.schema.json","$schema":"https://json-schema.org/draft/2020-12/schema","additionalProperties":false,"allOf":[{"if":{"properties":{"section":{"properties":{"group":{"const":"shared-infrastructure"}},"required":["group"]}},"required":["section"]},"then":{"properties":{"section":{"properties":{"family_visible":{"const":false}},"required":["family_visible"]}}}},{"$comment":"Family rule (derivation spec §4, Oct 30, 2026): section.family_visible true requires a private posture — status private, which derives Tier=Private. Family=True forces Tier=Private; alongside status public the manifest fails validation in the pull tool. The forcing resolves toward private, never toward public, and nothing overrides it.","if":{"properties":{"section":{"properties":{"family_visible":{"const":true}},"required":["family_visible"]}},"required":["section"]},"then":{"properties":{"status":{"enum":["private"]}},"required":["status"]}}],"description":"One per repo, at the root — and ONLY there (one project = one repo; Oct 29, 2026). A project's publish.json is the single source of its display data: title, blurb, links, status, shelf, and audience flags. Displays (the private section, the portfolio gate) PULL each manifest from the project's own repo at build time; no hand-maintained copies exist anywhere. There is deliberately no `repo` URL field: a card's Repo link is structural, derived by the consumer from the repo the manifest was pulled from, and Repo links are owner-view only. See PUBLISH-MANIFEST-SPEC (fleet records) and publish-registry/README.md.","properties":{"first_released":{"description":"ISO date (YYYY-MM-DD) of the project's first release, written once at publish time. Consumed only by the freshness derivation in scripts/publish_view.py (the 'New' badge window); never hand-set as a badge.","format":"date","type":"string"},"last_released":{"description":"ISO date (YYYY-MM-DD) of the project's most recent release or update, refreshed at publish time. Consumed only by the freshness derivation in scripts/publish_view.py (the 'Recently updated' badge window).","format":"date","type":"string"},"private_hosts":{"items":{"minLength":1,"type":"string"},"type":"array","uniqueItems":true},"project":{"minLength":1,"type":"string"},"public_urls":{"additionalProperties":false,"properties":{"demo":{"format":"uri","type":["string","null"]},"docs":{"format":"uri","type":["string","null"]},"interactive":{"format":"uri","type":["string","null"]},"site":{"format":"uri","type":["string","null"]}},"required":["site","demo","docs","interactive"],"type":"object"},"release_state":{"enum":["under_construction","testing","released"],"type":"string"},"section":{"additionalProperties":false,"properties":{"also":{"items":{"additionalProperties":false,"properties":{"blurb":{"minLength":1,"type":"string"},"family_visible":{"default":false,"type":"boolean"},"group":{"enum":["projects","family","shared-infrastructure"]},"link":{"format":"uri","type":"string"},"name":{"minLength":1,"type":"string"},"status":{"enum":["public","live","demo-only","private"]}},"required":["name","blurb","link"],"type":"object"},"type":"array"},"blurb":{"minLength":1,"type":"string"},"family_visible":{"default":false,"type":"boolean"},"group":{"enum":["projects","family","shared-infrastructure"]},"include":{"type":"boolean"},"link_audiences":{"additionalProperties":false,"description":"Per-link-kind audience narrowing for section entries. Audiences are 'owner' and 'family'. Defaults: every kind reaches both audiences, EXCEPT 'repo', which is owner-only by construction (the family dataset never carries a Repo link, and a declaration may narrow further but never widen 'repo' into the family audience — consumers fail on the attempt). Use this only to narrow a kind to the owner view, e.g. {\"demo\": [\"owner\"]}.","properties":{"demo":{"items":{"enum":["owner","family"],"type":"string"},"minItems":1,"type":"array","uniqueItems":true},"docs":{"items":{"enum":["owner","family"],"type":"string"},"minItems":1,"type":"array","uniqueItems":true},"interactive":{"items":{"enum":["owner","family"],"type":"string"},"minItems":1,"type":"array","uniqueItems":true},"live":{"items":{"enum":["owner","family"],"type":"string"},"minItems":1,"type":"array","uniqueItems":true},"repo":{"items":{"enum":["owner","family"],"type":"string"},"minItems":1,"type":"array","uniqueItems":true},"site":{"items":{"enum":["owner","family"],"type":"string"},"minItems":1,"type":"array","uniqueItems":true}},"type":"object"},"status":{"enum":["public","live","demo-only","private"]}},"required":["include","group","blurb"],"type":"object"},"status":{"enum":["public","private"]}},"required":["project","status","public_urls","private_hosts"],"title":"publish.json — fleet publish manifest","type":"object"}