{
  "first_released": "2026-10-29",
  "last_released": "2026-10-30",
  "private_hosts": [],
  "project": "Fleet Kit",
  "public_urls": {
    "demo": null,
    "docs": null,
    "interactive": null,
    "site": null
  },
  "release_state": "released",
  "section": {
    "also": [
      {
        "blurb": "Dependency-free visitor error-reporting core shared by the fleet's sites and apps.",
        "family_visible": false,
        "link": "https://github.com/andrewdhorowitz/fleet-kit/tree/main/error-reporter",
        "name": "Error reporter"
      },
      {
        "blurb": "The fleet's publish schema and generated private-host index, the portfolio link gate, and this private index.",
        "family_visible": false,
        "link": "https://github.com/andrewdhorowitz/fleet-kit/tree/main/publish-registry",
        "name": "Publishing system"
      }
    ],
    "blurb": "Shared kit code for the fleet \u2014 error reporter, diagram tooling, and the publishing system.",
    "family_visible": false,
    "group": "shared-infrastructure",
    "include": true
  },
  "status": "public"
}
